{
  "schemaVersion": "1.0.0",
  "kind": "materiaItemMetadata",
  "tokenStandard": "ERC1155",
  "network": "base",
  "chainId": 8453,
  "contractAddress": "0xd3258b6b0bAED28f7D90A808d3Cb39d8fF9eD080",
  "materiaItemDefinitionId": 1,
  "materiaDefinitionId": 1,
  "name": "Fire Materia Item",
  "description": "Published metadata for Fire Materia Item in the live Inpinity City system.",
  "image": "https://assets.inpinity.online/city/assets/materia-items/1.png",
  "external_url": "https://assets.inpinity.online/city/metadata/materia-items/1.json",
  "attributes": [
    {
      "trait_type": "Materia Item Definition ID",
      "value": 1,
      "display_type": "number"
    },
    {
      "trait_type": "Materia Definition ID",
      "value": 1,
      "display_type": "number"
    },
    {
      "trait_type": "Level",
      "value": 1,
      "display_type": "number"
    },
    {
      "trait_type": "Rarity Tier",
      "value": 2,
      "display_type": "number"
    },
    {
      "trait_type": "Rarity",
      "value": "Rare"
    },
    {
      "trait_type": "Burn On Use",
      "value": "Yes"
    },
    {
      "trait_type": "Enabled",
      "value": "Yes"
    }
  ],
  "verificationStatus": "confirmed",
  "notes": "Generated from live CityMateriaItems materiaItemDefinitionOf(1) on base."
}
